{
  "id": "mercenary",
  "name": "Söldner",
  "role": "frontline_bruiser",
  "role_tags": ["tank", "striker"],
  "description": "Ein standhafter Frontkämpfer, der Gegner mit Schild und Klinge unter Druck setzt.",
  "base_stats": {
    "hp": 60,
    "stamina": 30,
    "focus": 20,
    "attack": 7,
    "defense": 4,
    "magic": 0,
    "speed": 4,
    "crit_chance": 0.05
  },
  "stat_growth": {
    "hp": 7,
    "stamina": 3,
    "focus": 1,
    "attack": 1,
    "defense": 0,
    "magic": 0,
    "speed": 0
  },
  "starting_skills": ["shield_bash", "hold_the_line"],
  "skill_pool": ["shield_bash", "hold_the_line", "rending_cut"],
  "starting_items": ["iron_sword", "buckler", "leather_jerkin"],
  "reaction": "brace",
  "progression_track": "mercenary_track",
  "visual": {
    "silhouette": "broad_shield_forward",
    "accent_color": "#8c5a3c"
  }
}
