{
  "id": "scholar_mage",
  "name": "Gelehrtenmagier",
  "role": "control_caster",
  "role_tags": ["controller", "striker"],
  "description": "Ein fokussierter Zauberwirker, der Gegner mit arkanem Schaden und Frost kontrolliert.",
  "base_stats": {
    "hp": 38,
    "focus": 50,
    "stamina": 22,
    "attack": 2,
    "defense": 2,
    "magic": 9,
    "speed": 5,
    "crit_chance": 0.06
  },
  "stat_growth": {
    "hp": 4,
    "focus": 5,
    "stamina": 1,
    "attack": 0,
    "defense": 0,
    "magic": 1,
    "speed": 0
  },
  "starting_skills": ["arcane_bolt", "frost_sigil"],
  "skill_pool": ["arcane_bolt", "frost_sigil", "focused_mind"],
  "starting_items": ["oak_staff", "scholars_robe", "focus_draught"],
  "reaction": "ward",
  "progression_track": "scholar_mage_track",
  "visual": {
    "silhouette": "hooded_staff",
    "accent_color": "#7789c4"
  }
}
